{
  "$schema": "https://json-schema.org/draft/2020-12/schema",
  "title": "skillcard.parse output",
  "type": "object",
  "required": ["ok", "frontmatter", "errors", "warnings", "body", "profile", "source"],
  "properties": {
    "ok": { "type": "boolean" },
    "frontmatter": {
      "type": "object",
      "additionalProperties": { "type": "string" }
    },
    "errors": {
      "type": "array",
      "items": {
        "type": "object",
        "required": ["code", "message"],
        "properties": {
          "code": { "type": "string", "minLength": 1 },
          "message": { "type": "string", "minLength": 1 },
          "line": { "type": "integer", "minimum": 1 }
        },
        "additionalProperties": false
      }
    },
    "warnings": {
      "type": "array",
      "items": {
        "type": "object",
        "required": ["code", "message"],
        "properties": {
          "code": { "type": "string", "minLength": 1 },
          "message": { "type": "string", "minLength": 1 },
          "line": { "type": "integer", "minimum": 1 }
        },
        "additionalProperties": false
      }
    },
    "body": { "type": ["string", "null"] },
    "profile": { "type": "string", "enum": ["compat", "anthropic-v1", "openai-codex-v1"] },
    "source": {
      "type": "object",
      "required": ["mode"],
      "properties": {
        "mode": { "type": "string", "enum": ["path", "text"] },
        "path": { "type": "string", "minLength": 1 }
      },
      "additionalProperties": false
    }
  },
  "additionalProperties": false
}
